{
  "schema_version": "1.0",
  "message_type": "approval_readiness",
  "created_at": "2026-07-18T10:02:00Z",
  "safety_flags": {
    "synthetic_local_only": true,
    "mock_only": true,
    "dry_run": true,
    "owner_review_required": true,
    "external_side_effects_allowed": false,
    "external_side_effects_occurred": false,
    "blackboard_write_allowed": false,
    "queue_write_allowed": false,
    "audit_trail_write_allowed": false,
    "worker_dispatch_allowed": false,
    "openclaw_call_allowed": false,
    "hermes_runtime_allowed": false,
    "connector_call_allowed": false,
    "google_sheets_write_allowed": false,
    "follow_up_allowed": false,
    "follow_up_requires_owner_confirmation": true
  },
  "prev_entry_hash": "bbbbbbbbbbbbbbbbbbbbbbbbbbbbbbbbbbbbbbbbbbbbbbbbbbbbbbbbbbbbbbbb",
  "execution_class": "AUTO",
  "produced_by": "approval-readiness-preview",
  "parent_task_id": null,
  "role": "readiness_checker",
  "readiness_id": "readiness-phase3-001",
  "task_id": "task-phase3-001",
  "annotation_id": "annotation-phase3-001",
  "readiness_status": "READY_FOR_OWNER_REVIEW",
  "validation_status": "validated_preview",
  "reasons": [
    "The task is a synthetic read-only query."
  ],
  "next_step_allowed": true,
  "next_step_requires_owner_confirmation": true,
  "next_owner_action": "Owner may issue a synthetic PASS or HOLD decision."
}
